{
  "contract": "lesson-context 0.1",
  "source": {
    "kind": "neutral-course-intake",
    "repository": "trilogy-group/ela-lessons",
    "commit": "3ed708e126aec14b7456679b9236e01c1081df16",
    "path": "src/content/othello-1-1.json",
    "sha256": "04184809a63e492b54fcf82a7583bd3a0b11483285c5920ce3752929947f8337",
    "prototype_revision": "B1006-proposed-0.1",
    "note": "Exact authored source extracts; proposed placements; no old authored questions or marker keys."
  },
  "lesson": {
    "id": "G9-U1-L1-B1006-PROTOTYPE",
    "title": "Othello Act 1, Scene 1",
    "learning_question": "At the beginning of the play, how does Shakespeare show that Iago is only pretending to be loyal to Othello?",
    "keywords": [
      {
        "word": "betrayal",
        "meaning": "breaking someone's trust",
        "link": "what deceit does to a relationship",
        "cls": "noun"
      },
      {
        "word": "deceitful",
        "meaning": "tricking people by hiding the truth",
        "link": "a person full of deceit",
        "cls": "adjective"
      },
      {
        "word": "untrustworthy",
        "meaning": "cannot be relied on",
        "link": "how deceit makes others see you",
        "cls": "adjective"
      },
      {
        "word": "disloyal",
        "meaning": "not faithful to someone you should support",
        "link": "deceit toward a leader or friend",
        "cls": "adjective"
      },
      {
        "word": "pretense",
        "meaning": "acting as if something is true when it isn't",
        "link": "deceit in action",
        "cls": "noun"
      },
      {
        "word": "façade",
        "meaning": "a false front that hides what is behind it",
        "link": "the \"mask\" of deceit",
        "cls": "noun"
      }
    ]
  },
  "native": {
    "lessonId": "G9-U1-L1-B1006-PROTOTYPE",
    "title": "Othello",
    "subtitle": "Act 1, Scene 1",
    "question": "At the beginning of the play, how does Shakespeare show that Iago is only pretending to be loyal to Othello?",
    "pages": [
      {
        "id": "F-ORIENT",
        "proposal_status": "proposed-authoring-choice",
        "phase_role": "instruction",
        "nodes": [
          {
            "id": "orientation",
            "type": "instruction",
            "learning_question": "At the beginning of the play, how does Shakespeare show that Iago is only pretending to be loyal to Othello?",
            "keywords": [
              {
                "word": "betrayal",
                "meaning": "breaking someone's trust",
                "link": "what deceit does to a relationship",
                "cls": "noun"
              },
              {
                "word": "deceitful",
                "meaning": "tricking people by hiding the truth",
                "link": "a person full of deceit",
                "cls": "adjective"
              },
              {
                "word": "untrustworthy",
                "meaning": "cannot be relied on",
                "link": "how deceit makes others see you",
                "cls": "adjective"
              },
              {
                "word": "disloyal",
                "meaning": "not faithful to someone you should support",
                "link": "deceit toward a leader or friend",
                "cls": "adjective"
              },
              {
                "word": "pretense",
                "meaning": "acting as if something is true when it isn't",
                "link": "deceit in action",
                "cls": "noun"
              },
              {
                "word": "façade",
                "meaning": "a false front that hides what is behind it",
                "link": "the \"mask\" of deceit",
                "cls": "noun"
              }
            ],
            "key_term": {
              "term": "Machiavellian villain",
              "meaning": "Machiavellian: using cunning and lies to gain power. A Machiavellian villain schemes and deceives to get what he wants."
            },
            "glossary": [
              {
                "term": "Roderigo",
                "note": "a rich young man who wants to marry Desdemona",
                "at": {
                  "part": 0,
                  "block": 4,
                  "line": 0,
                  "match": "Roderigo"
                }
              },
              {
                "term": "Iago",
                "note": "Othello's ensign: the officer who carries the general's flag",
                "at": {
                  "part": 0,
                  "block": 4,
                  "line": 0,
                  "match": "Iago"
                }
              },
              {
                "term": "Desdemona",
                "note": "Brabantio's daughter, who has secretly married Othello",
                "at": {
                  "part": 0,
                  "block": 4,
                  "line": 0,
                  "match": "Desdemona"
                }
              },
              {
                "term": "Brabantio",
                "note": "a powerful senator of Venice and Desdemona's father",
                "at": {
                  "part": 0,
                  "block": 4,
                  "line": 0,
                  "match": "Brabantio"
                }
              },
              {
                "term": "Cassio",
                "note": "Othello's new lieutenant",
                "at": {
                  "part": 0,
                  "block": 5,
                  "line": 0,
                  "match": "Cassio"
                }
              },
              {
                "term": "lieutenant",
                "note": "the officer second in command to the general",
                "at": {
                  "part": 0,
                  "block": 5,
                  "line": 0,
                  "match": "lieutenant"
                }
              },
              {
                "term": "Off-capped",
                "note": "took off their hats to show respect when they asked Othello to promote Iago",
                "at": {
                  "part": 1,
                  "block": 1,
                  "line": 10,
                  "match": "Off-capped"
                }
              },
              {
                "term": "I know my price",
                "note": "I know what I'm worth",
                "at": {
                  "part": 1,
                  "block": 1,
                  "line": 11,
                  "match": "I know my price"
                }
              },
              {
                "term": "Forsooth",
                "note": "\"in truth\", said sarcastically here",
                "at": {
                  "part": 1,
                  "block": 3,
                  "line": 2,
                  "match": "Forsooth"
                }
              },
              {
                "term": "arithmetician",
                "note": "a man who is good with numbers, not with fighting. Iago is mocking Cassio.",
                "at": {
                  "part": 1,
                  "block": 3,
                  "line": 2,
                  "match": "arithmetician"
                }
              },
              {
                "term": "his Moorship's ancient",
                "note": "\"ancient\" means ensign. \"Moorship\" is a mocking title Iago invents for Othello.",
                "at": {
                  "part": 1,
                  "block": 3,
                  "line": 10,
                  "match": "his Moorship's ancient"
                }
              },
              {
                "term": "Preferment",
                "note": "promotion",
                "at": {
                  "part": 1,
                  "block": 3,
                  "line": 11,
                  "match": "Preferment"
                }
              },
              {
                "term": "letter and affection",
                "note": "who you know and who likes you",
                "at": {
                  "part": 1,
                  "block": 3,
                  "line": 11,
                  "match": "letter and affection"
                }
              },
              {
                "term": "old gradation",
                "note": "the old system, where you were promoted in order of experience",
                "at": {
                  "part": 1,
                  "block": 3,
                  "line": 12,
                  "match": "old gradation"
                }
              },
              {
                "term": "affined",
                "note": "bound, or obliged",
                "at": {
                  "part": 1,
                  "block": 3,
                  "line": 14,
                  "match": "affined"
                }
              }
            ],
            "credit": "Text: abridged from the Folger Shakespeare edition (CC BY-NC 3.0)."
          }
        ],
        "question_slots": []
      },
      {
        "id": "F-CONTEXT",
        "proposal_status": "proposed-authoring-choice",
        "phase_role": "independent-reading-checks",
        "nodes": [
          {
            "id": "F-CONTEXT-text",
            "type": "reading",
            "blocks": [
              {
                "kind": "title",
                "title": "Othello",
                "by": "by William Shakespeare"
              },
              {
                "kind": "heading",
                "text": "About the play"
              },
              {
                "kind": "para",
                "text": "Othello is a tragedy by William Shakespeare, written around 1603. It tells the story of Othello, a Black African general who leads the army of Venice. Othello is respected and powerful, but in Venice he is also an outsider. One of his own officers, Iago, secretly hates him. Over the course of the play, Iago sets out to destroy Othello using nothing but lies."
              },
              {
                "kind": "heading",